{
  "$schema": "https://json-schema.org/draft/2020-12/schema",
  "$id": "otsec.audit/0.1/record",
  "title": "Audit record (C8). Chained per node: prev_hash is the SHA-256 of the previous record's stored bytes. Readers ignore unknown fields (not strict), except fields named like secrets, which make the record invalid.",
  "type": "object",
  "required": [
    "contract",
    "node_id",
    "seq",
    "prev_hash",
    "time",
    "actor",
    "action",
    "outcome"
  ],
  "propertyNames": {
    "not": {
      "anyOf": [
        {
          "pattern": "^(?i:secret|password|passwd|pwd|passphrase|credential_value|private_key|raw_output)$"
        },
        {
          "allOf": [
            {
              "pattern": "^(?i:transcript.*)$"
            },
            {
              "not": {
                "const": "transcript_sha256"
              }
            }
          ]
        }
      ]
    }
  },
  "properties": {
    "contract": {
      "type": "string",
      "pattern": "^otsec\\.audit/0\\.(0|[1-9][0-9]{0,3})$"
    },
    "node_id": {
      "type": "string",
      "pattern": "^[a-z0-9](?:[a-z0-9-]{0,61}[a-z0-9])?$",
      "description": "contracts/node IDPattern (D1-1)"
    },
    "seq": {
      "type": "integer",
      "minimum": 1
    },
    "prev_hash": {
      "type": "string",
      "pattern": "^[0-9a-f]{64}$"
    },
    "time": {
      "type": "object",
      "required": [
        "utc",
        "resolution_ns",
        "clock"
      ],
      "properties": {
        "utc": {
          "type": "string",
          "pattern": "^[0-9]{4}-[0-9]{2}-[0-9]{2}T[0-9]{2}:[0-9]{2}:[0-9]{2}(\\.[0-9]{1,9})?Z$"
        },
        "resolution_ns": {
          "type": "integer",
          "minimum": 1
        },
        "clock": {
          "type": "object",
          "required": [
            "sync"
          ],
          "properties": {
            "sync": {
              "enum": [
                "synchronized",
                "unsynchronized",
                "unknown"
              ]
            },
            "source": {
              "type": "string",
              "pattern": "^[a-z][a-z0-9-]{0,31}$"
            }
          }
        }
      },
      "description": "C4 event.Received; always the node clock"
    },
    "actor": {
      "type": "object",
      "required": [
        "type",
        "id"
      ],
      "properties": {
        "type": {
          "enum": [
            "human",
            "schedule",
            "node",
            "system"
          ]
        },
        "id": {
          "type": "string"
        },
        "role": {
          "enum": [
            "monitor",
            "engineer",
            "admin",
            "security-auditor",
            "collector"
          ]
        },
        "session_id": {
          "type": "string"
        },
        "auth_method": {
          "type": "string"
        }
      }
    },
    "action": {
      "enum": [
        "collector.request",
        "device.session.open",
        "device.session.close",
        "credential.use",
        "device.op",
        "device.refused",
        "device.posture_warning",
        "credential.install",
        "credential.revoke",
        "credential.suspend",
        "credential.clear_suspension",
        "register.verify",
        "register.activate",
        "auth.login",
        "auth.fail",
        "auth.logout",
        "role.grant",
        "role.revoke",
        "policy.apply",
        "audit.chain.start",
        "audit.checkpoint",
        "audit.export",
        "clock.change",
        "storage.alarm",
        "service.start",
        "service.stop",
        "store.mode_change",
        "node.posture_change",
        "node.migration_date",
        "asset.collector_assign"
      ]
    },
    "outcome": {
      "enum": [
        "allowed",
        "denied",
        "succeeded",
        "failed",
        "warning",
        "info"
      ]
    },
    "reason_code": {
      "type": "string",
      "pattern": "^[a-z][a-z0-9_]{0,47}$"
    },
    "target": {
      "type": "object",
      "properties": {
        "asset_id": {
          "type": "string",
          "pattern": "^[0-9a-f]{8}-[0-9a-f]{4}-[1-8][0-9a-f]{3}-[89ab][0-9a-f]{3}-[0-9a-f]{12}$",
          "description": "TODO(C1): C1 asset ID (lowercase UUID)"
        },
        "transport": {
          "enum": [
            "telnet",
            "serial",
            "ssh"
          ]
        },
        "downstream_security": {
          "enum": [
            "encrypted-authenticated",
            "encrypted-weak",
            "plaintext-unauthenticated"
          ]
        },
        "credential_ref": {
          "type": "string",
          "pattern": "^cred_[a-z0-9]{8,40}$"
        },
        "credential_version": {
          "type": "integer",
          "minimum": 1
        },
        "family": {
          "type": "string"
        }
      },
      "if": {
        "properties": {
          "transport": {
            "enum": [
              "telnet",
              "serial"
            ]
          }
        },
        "required": [
          "transport"
        ]
      },
      "then": {
        "required": [
          "downstream_security"
        ],
        "properties": {
          "downstream_security": {
            "const": "plaintext-unauthenticated"
          }
        }
      }
    },
    "operation_id": {
      "type": "string"
    },
    "register_revision": {
      "type": "integer",
      "minimum": 1
    },
    "policy_version": {
      "type": "integer",
      "minimum": 1
    },
    "params_digest": {
      "type": "string",
      "pattern": "^sha256:[0-9a-f]{64}$"
    },
    "bytes_sent_digest": {
      "type": "string",
      "pattern": "^sha256:[0-9a-f]{64}$"
    },
    "transcript_sha256": {
      "type": "string",
      "pattern": "^[0-9a-f]{64}$",
      "description": "D1-25: C2 transcript.sha256, the SHA-256 of the session transcript exactly as stored. Required on device.session.close and on no other action."
    },
    "correlation_id": {
      "type": "string"
    },
    "collector_seq": {
      "type": "integer",
      "minimum": 1,
      "description": "C7-A5-2: the collector's number for an event it reported. Required on device actions, credential.use, credential.suspend, register.verify and register.activate, on collector.request allowed or denied, and on the collector's result of a credential install, revocation or clearing (audit.CollectorReported). VerifyCollectorSeq finds an omitted record as a gap."
    },
    "detail": {
      "type": "string",
      "maxLength": 512
    }
  },
  "allOf": [
    {
      "if": {
        "properties": {
          "outcome": {
            "enum": [
              "denied",
              "failed",
              "warning"
            ]
          }
        }
      },
      "then": {
        "required": [
          "reason_code"
        ]
      }
    },
    {
      "if": {
        "properties": {
          "seq": {
            "const": 1
          }
        }
      },
      "then": {
        "properties": {
          "prev_hash": {
            "const": "0000000000000000000000000000000000000000000000000000000000000000"
          },
          "action": {
            "const": "audit.chain.start"
          }
        }
      }
    },
    {
      "if": {
        "properties": {
          "action": {
            "enum": [
              "device.session.open",
              "device.session.close",
              "credential.use",
              "device.op",
              "device.refused",
              "device.posture_warning"
            ]
          }
        }
      },
      "then": {
        "required": [
          "target",
          "correlation_id"
        ],
        "properties": {
          "target": {
            "required": [
              "asset_id",
              "transport",
              "downstream_security"
            ]
          }
        }
      }
    },
    {
      "if": {
        "properties": {
          "action": {
            "const": "device.session.close"
          }
        },
        "required": [
          "action"
        ]
      },
      "then": {
        "required": [
          "transcript_sha256"
        ]
      },
      "else": {
        "not": {
          "required": [
            "transcript_sha256"
          ]
        }
      }
    }
  ]
}
