{"contract":"otsec.audit/0.1","node_id":"site-a-node-1","seq":4,"prev_hash":"36fa7ac0ca38043f62f453ecd75ecb7c45657ded6e9708ab32e5e9e42abda266","time":{"utc":"2026-10-24T11:40:00.123456Z","resolution_ns":1000,"clock":{"sync":"synchronized","source":"ntp"}},"actor":{"type":"schedule","id":"sch-ser-751-feeder-3","role":"collector"},"action":"device.refused","outcome":"denied","reason_code":"identity_mismatch","target":{"asset_id":"2b7d4e10-8c3f-4a5b-9e21-7c4f0d6a8b13","transport":"telnet","downstream_security":"plaintext-unauthenticated","credential_ref":"cred_7f3k2m9q4x","credential_version":2,"family":"sel-751"},"correlation_id":"0f3e6c1a-8b2d-4e7f-9a15-6c4d2b8e0a71","collector_seq":3,"detail":"SER header serial number differs from the declared value"}
